[
  {
    "id": "left-earth-compressed-body",
    "label": "Compressed earth body",
    "side": "traditional",
    "zone": "left-center vertical mass",
    "category": "earth_body",
    "description": "Anthropomorphic carved earth mass representing land under extractive pressure: cut, compressed, wounded, and made into structure rather than living relation.",
    "data_triggers": ["claim", "policy_update", "funding_shift", "court_ruling", "field_report"],
    "visual_state": "seed",
    "position": { "x": 33, "y": 46 },
    "asset": null,
    "notes": "Core left-side figure. Must remain visible even in early state."
  },
  {
    "id": "right-earth-relational-body",
    "label": "Relational living earth",
    "side": "regenerative",
    "zone": "right distributed body-landscape",
    "category": "earth_body",
    "description": "Distributed living earth figure made from canopy, slope, water, rocks, understory, fungal life, animal presence, and cultivated relations.",
    "data_triggers": ["study", "field_report", "dataset", "community_upload", "natural_event"],
    "visual_state": "seed",
    "position": { "x": 68, "y": 45 },
    "asset": null,
    "notes": "Not a single statue-like figure. It is a body-landscape."
  },
  {
    "id": "river-border",
    "label": "River border",
    "side": "shared",
    "zone": "central vertical river seam",
    "category": "river_border",
    "description": "The river is the real border between the two worlds and the methodological seam of the app.",
    "data_triggers": ["dataset", "policy_update", "field_report", "court_ruling", "natural_event"],
    "visual_state": "seed",
    "position": { "x": 47, "y": 58 },
    "asset": null,
    "notes": "Replaces any generic CSS divider."
  },
  {
    "id": "black-dog-chained-tree",
    "label": "Black dog chained to tree",
    "side": "traditional",
    "zone": "left middle-lower area",
    "category": "animal_welfare",
    "description": "Black chained dog near the extractive land figure, representing captivity, coercion, and animal life held inside extractive relations.",
    "data_triggers": ["claim", "field_report", "court_ruling", "policy_update", "community_upload"],
    "visual_state": "seed",
    "position": { "x": 27, "y": 46 },
    "asset": null,
    "notes": "Confirmed detail in MAP 22. Do not remove."
  },
  {
    "id": "monoculture-grid-blocks",
    "label": "Monoculture grid blocks",
    "side": "traditional",
    "zone": "upper-left cultivated blocks",
    "category": "soil_structure",
    "description": "Regular grid-like planting blocks representing simplified land use, monoculture logic, and spatial flattening.",
    "data_triggers": ["claim", "dataset", "study", "policy_update"],
    "visual_state": "seed",
    "position": { "x": 12, "y": 9 },
    "asset": null,
    "notes": "Useful for yield, monoculture, subsidy and land-use entries."
  },
  {
    "id": "extractive-cavities-tunnels",
    "label": "Cavities and tunnels",
    "side": "traditional",
    "zone": "left lower carved ground",
    "category": "soil_structure",
    "description": "Openings, tunnels, and cut sections in the extractive side showing depletion, rupture, and forced access to the land body.",
    "data_triggers": ["study", "dataset", "claim", "field_report", "natural_event"],
    "visual_state": "seed",
    "position": { "x": 23, "y": 72 },
    "asset": null,
    "notes": "Can thicken with erosion, compaction, soil loss, mining, or overwork data."
  },
  {
    "id": "controlled-tree-mass",
    "label": "Controlled tree mass",
    "side": "traditional",
    "zone": "central-left tree / trunk structure",
    "category": "biodiversity",
    "description": "Dark branching tree-like form embedded in the extractive side, connected to control, shadow, restraint, and habitat loss.",
    "data_triggers": ["policy_update", "claim", "field_report", "dataset", "natural_event"],
    "visual_state": "seed",
    "position": { "x": 36, "y": 30 },
    "asset": null,
    "notes": "Can link to deforestation, hunting pressure, habitat fragmentation, and legal rulings."
  },
  {
    "id": "soil-erosion-exposed-ground",
    "label": "Exposed eroded ground",
    "side": "traditional",
    "zone": "left lower slopes and exposed brown mass",
    "category": "soil_structure",
    "description": "Bare brown exposed ground representing soil loss, compaction, erosion, and degraded structure.",
    "data_triggers": ["study", "dataset", "field_report", "natural_event", "overclaim_correction"],
    "visual_state": "seed",
    "position": { "x": 18, "y": 63 },
    "asset": null,
    "notes": "Can react to tillage, erosion, runoff, drought and compaction entries."
  },
  {
    "id": "paulownia-trees-flowering",
    "label": "Paulownia trees in flower",
    "side": "regenerative",
    "zone": "right-side flowering tree clusters",
    "category": "biodiversity",
    "description": "Purple flowering Paulownia trees. These are not generic flowers; they are flowering trees integrated into the regenerative landscape.",
    "data_triggers": ["study", "field_report", "dataset", "community_upload", "natural_event"],
    "visual_state": "seed",
    "position": { "x": 60, "y": 56 },
    "asset": null,
    "notes": "Corrected detail: skip generic purple flowers. Use Paulownia in flower."
  },
  {
    "id": "canopy-understory-guild",
    "label": "Canopy and understory guild",
    "side": "regenerative",
    "zone": "right upper and middle vegetation",
    "category": "biodiversity",
    "description": "Layered vegetation expressing food forest structure, ecological succession, habitat continuity, and mixed-species relations.",
    "data_triggers": ["study", "dataset", "field_report", "community_upload"],
    "visual_state": "seed",
    "position": { "x": 72, "y": 30 },
    "asset": null,
    "notes": "Primary regenerative density element."
  },
  {
    "id": "water-retention-stream-system",
    "label": "Water retention and stream system",
    "side": "regenerative",
    "zone": "right lower water and stream paths",
    "category": "water_system",
    "description": "Visible water movement, retention zones, stream branches, and hydrated landforms representing hydrological repair.",
    "data_triggers": ["study", "dataset", "field_report", "natural_event", "sensor_signal"],
    "visual_state": "seed",
    "position": { "x": 73, "y": 75 },
    "asset": null,
    "notes": "Connect to drought resilience, runoff, infiltration, wetland, riparian and water-holding data."
  },
  {
    "id": "fungal-mushroom-zone",
    "label": "Fungal and mushroom zone",
    "side": "regenerative",
    "zone": "right lower understory and soil edge",
    "category": "soil_structure",
    "description": "Fungal / mushroom presence representing soil food web, decomposition, mycorrhizal relations, and living substrate.",
    "data_triggers": ["study", "dataset", "field_report", "community_upload"],
    "visual_state": "seed",
    "position": { "x": 74, "y": 68 },
    "asset": null,
    "notes": "Can be enriched by soil microbiome, compost, mycorrhiza, and substrate entries."
  },
  {
    "id": "rocks-living-soil",
    "label": "Rocks and living soil",
    "side": "regenerative",
    "zone": "right lower rocky wet ground",
    "category": "soil_structure",
    "description": "Rocks, organic matter, hydrated surface, and small soil structures forming the living base of the regenerative side.",
    "data_triggers": ["study", "dataset", "field_report", "natural_event"],
    "visual_state": "seed",
    "position": { "x": 78, "y": 82 },
    "asset": null,
    "notes": "Should carry field data, soil tests, ECHO-style observations, and hydrological markers."
  },
  {
    "id": "integrated-solar-panels",
    "label": "Integrated solar panels",
    "side": "regenerative",
    "zone": "future regenerative infrastructure layer",
    "category": "energy_monitoring",
    "description": "Solar panels integrated into roofs, small structures, terrain-friendly arrays, and regenerative infrastructure rather than imposed industrial objects.",
    "data_triggers": ["dataset", "policy_update", "funding_shift", "field_report", "community_upload"],
    "visual_state": "emerging",
    "position": { "x": 82, "y": 43 },
    "asset": null,
    "notes": "Not present as a finalized MAP 22 base element yet; should be generated as a compatible layer."
  },
  {
    "id": "solar-drones-monitoring",
    "label": "Solar drones monitoring fire, air, and soil",
    "side": "regenerative",
    "zone": "upper-right sky / monitoring layer",
    "category": "energy_monitoring",
    "description": "Lightweight solar monitoring drones for wildfire risk, air quality, and soil/vegetation monitoring, belonging to the regenerative system.",
    "data_triggers": ["sensor_signal", "natural_event", "dataset", "field_report", "funding_shift"],
    "visual_state": "emerging",
    "position": { "x": 85, "y": 20 },
    "asset": null,
    "notes": "Generated layer should feel ecological, not military or industrial."
  },
  {
    "id": "community-practice-paths",
    "label": "Community practice paths",
    "side": "regenerative",
    "zone": "right pathways and cultivated relation areas",
    "category": "community_practice",
    "description": "Paths, working spaces, care zones, nursery logic, and human-scale practice areas where evidence becomes lived technique.",
    "data_triggers": ["community_upload", "field_report", "policy_update", "funding_shift"],
    "visual_state": "seed",
    "position": { "x": 82, "y": 62 },
    "asset": null,
    "notes": "Can connect to gallery uploads, farm reports, forum threads, and guided learning."
  }
]
